{"authority":"local-static-synthetic-privacy-classifier","campaign_authorized":false,"cloud_execution_observed":false,"deletion":{"accepted_transition_count":8,"actual_eks_deletion":"unexecuted","actual_object_store_deletion":"unexecuted","failure_contract":"stop-no-success-no-retry","initial_state":"retained","legal_hold":"none-separate","reason_code":"STAGE5_DELETION_SEQUENCE_COMPLETE","result":"synthetic-sequence-complete","retention_seconds":2592000,"terminal_state":"deleted-verified","uncertainty_contract":"sticky-preserve-unconfirmed-no-unknown-to-absent","version_deletion":"all-versions-and-delete-markers"},"external_model_invoked":false,"issue":365,"kubernetes_execution_observed":false,"privacy":{"affected_surfaces":[],"attachments_excluded":true,"categories":[],"finding_count":0,"finding_root_sha256":null,"raw_export_boundary":"explicit-sensitive-authenticated-non-model-no-payload","reason_code":"STAGE5_PRIVACY_CLEAR","result":"clear","sensitive_marking":"present","surfaces_scanned":6},"provider_execution_observed":false,"qualified":false,"release_eligible":false,"scope":"local-static-synthetic-only","status":"local-contract-pass","suite_sha256":"d8c8f82f830bfd19cac154da0cec9bb2b9ce707fe4762c275804a55ecae256b4","version":"cogs.stage5-privacy-deletion-report/v1"}
